{
  "schemaVersion": 1,
  "execution": {
    "taskId": "17",
    "attempt": 0
  },
  "observedAt": "2026-10-16T01:00:00Z",
  "taskStatus": "failed",
  "sdkVersion": "0.1.25",
  "checkpointResume": {
    "supported": false,
    "reason": "SDK 0.1.25 has no interrupted-scan resume entry point."
  },
  "committedResult": {
    "state": "unsupported",
    "sha256": null,
    "reason": "A complete committed result can be restored without model calls."
  },
  "restart": {
    "allowed": true,
    "reason": "A new execution can repeat model work."
  },
  "recovery": null,
  "interruption": {
    "allowed": false,
    "reason": "Execution is already terminal."
  }
}
