{
  "schemaVersion": 1,
  "execution": {
    "taskId": "17",
    "attempt": 1
  },
  "observedAt": "2026-10-16T01:00:00Z",
  "taskStatus": "failed",
  "sdkVersion": "0.1.25",
  "checkpointResume": {
    "supported": false,
    "reason": "SDK 0.1.25 has no interrupted-scan resume entry point."
  },
  "committedResult": {
    "state": "archived",
    "sha256": "aaaaaaaaaaaaaaaaaaaaaaaaaaaaaaaaaaaaaaaaaaaaaaaaaaaaaaaaaaaaaaaa",
    "reason": "A complete committed result can be restored without model calls."
  },
  "restart": {
    "allowed": true,
    "reason": "A new execution can repeat model work."
  },
  "recovery": {
    "commitSha256": "aaaaaaaaaaaaaaaaaaaaaaaaaaaaaaaaaaaaaaaaaaaaaaaaaaaaaaaaaaaaaaaa",
    "recoveredAt": "2026-10-16T01:00:01Z",
    "recoveredBy": "fixture-operator",
    "previousStatus": "failed",
    "previousErrorCode": "lease_expired",
    "previousErrorMessage": "Fixture execution interrupted.",
    "previousCompletion": {
      "schemaVersion": 1,
      "execution": {
        "taskId": "18",
        "attempt": 1
      },
      "agentId": "fixture-agent",
      "executionStatus": "failed",
      "process": {
        "code": 10,
        "signal": null,
        "resultCommitted": false
      },
      "error": {
        "code": "lease_expired",
        "origin": "agent",
        "message": "Fixture execution interrupted.",
        "retryable": false
      }
    },
    "previousCost": null
  },
  "interruption": {
    "allowed": false,
    "reason": "Execution is already terminal."
  }
}
